Summary,Review,Rating
Would've benefited from having music playing,"The hardest part was trying to stay focused on my work when I could hear the other Call agents working around me, request being denied to listen to music when working Emails or working Offline all day. The most enjoyable part of the job was knowing that I helped our Stores out to better serve our customers. For the most part I liked the people I worked with. Except I sat near someone that talked a lot to their neighbors in that row whenever they were not on the phone. I found that very distracting and I would get very irritated. I learned how the Walmart Stores worked. How customers would request Special orders from the stores. How we try our hardest to get the request fulfilled or find like items for the customers.",4
Awesome company!,"Biggest company in the world!  Great company to work for, very diverse and associates are very helpful. Walmart Associates practice 3 basic beliefs introduced by Sam Walton.  Walmart treat associates with respect and great benefits.",5
Working place,It is very nice to work with TCS employees . The TCS is building is good to work compare to Walmart ISD building. ISD is very conjugated place to work.,3
Optional courses to take,"Not a bad place to work, was much better for the first few years until our management changed.  Most people were friendly and willing to help each other out.  Used to have a lot of outside activities for employees until management decided we didn't need any at all.",3
Too many managers,"At Walmart I was a sales associate so I helped customers, cashiered, stocked shelves, designed mods, and more little stuff. The management stepped on each others toes too much  and it was hard to get a clear message to the associates because they were all saying something different. It was a decent job though.",3
Easy but repetitive tasks,"Would spend the majority of the shift straitening out aisles, other time was spent restocking and maintaining the backroom inventory. Occasionally asked to work other departments.",4
Working at Walmart Home Office,"Overall, it has been a great experience.  In any corporate environment, you have to be coachable and adjust to change.  At Walmart, change is constant.",4
Had learned many aspects,"I worked with walmart as contract based, my team was very friendly and had lot communication with them in all the aspects. Good job envirnoment.",3
Na,Good stable company to work for.  Flexible hours and competitive pay.  Friendly atmosphere. Always room for advancement and growth with the company.,3
Customer-Service based work,"As a customer service manager, I run around like a chicken with its head cut off. It is extremely stressful, but I highly enjoy interacting with customers on a daily basis. Typically, every day entails something different. At this moment, our store is going through many changes so management has a hard time telling us what needs to be done. They all tell us differently. There is a large amount of tension and unnecessary drama on the front end between a few of my co-workers and it brings the environment down. However, the work itself is enjoyable. I enjoy my co-workers' presences, and I love when customers leave with a smile. I also love being a leader for all of the cashiers.",4
Work-Life Balance,Working for the Walmart Home Office gave me great experience working for a large retailer in the back-office side of accounting and finance. I learned a great deal pertaining to contracts and vendor relationships as well as SOX Compliance.,5
Buying,Walmart was a great place to working. They gave you a lot of autonomy to make decisions. You could easily see the impact you made on sales. The management team was top notch and highly supportive.,4
Secure Job For Management,"For a Manager Walmart can provide security and opportunity.You will be required to work hard but there is opportunity for advancement. Hours are not the best, it is retail.It is what you make out of it",3
Good Work/Life Balance,Company has good Work/Life Balance. Has good training opportunities.Co-workers were easy to get along with and were willing to help their co-workers.,3
Great Company!,This place has a very diverse culture and plenty of room to grow. They are willing to help you find where you belong within the company. The management I've experienced thus far has been amazing. The only down side to this job from what I can tell is the strictness about you schedule when it comes to breaks and lunches. You are REQUIRED to take them. They are not lenient when it comes to skipping a 15 minute break because you are busy with your work. Other than that I love this company.,5
A Great Career Move,"Overall is a great place to work; however, it does depend on the management you have they can make or break your career at the company.",3
Rewarding place to work and learn.,Rewarding place to work and learn. Fun at times. Culture not as good as used to be. Leans to outside forces diluting core company principles. Has already and will continue to hurt company in the future.,3
Horrible,"Was with them for many years.  The first 8 or so were great.  Management at the top changed and so did philosophy.  All associates are disposable and expendable.  You are just a number.  No respect, thought or care for any associates.  Stress is unbearable.  Job is threatened daily.  The higher you move up, the worse it is.  Managers dropping like flies with strokes, heart attacks, suicides, etc.  When the management is miserable, this trickles down to the associates.  That's why you never see an associate at this company smiling.  They are all hating their jobs. Pay and benefits are fine, but they would get MUCH more bang for their buck with appreciating their people.",1
Good place to work,"I enjoy what I do. love customer service. I like taking care of other people. Doing so by paying their bills or wiring transferring money for them. Great team I work with. Manager is a Nice man. I just need to make more money. I lost my husband in April 2015. Now am totally responsible for me. l",4
Job environment very poor,"My experience at Walmart GSS-NA was very poor and stressful. Management ran things without honesty and integrity, and did not handle people or problems in a respectful manner. Every one on the team was micromanaged to the point of insanity. If you were not favored by the work flow or the supervisor, then you were looked over and regarded as unintelligent.  My experience with Walmart.com, however, was great. The team cared for each individual person, and the supervisor wanted you to excel in everything you did. It was a very uplifting and light hearted atmosphere.",3
Corporate office setting,"This company is very cost conscious, but  tends to promote from within making it a good opportunity for advancement in all areas, even in the retail stores as well.",3
Everyday,Everyday we come in to work and review numerous high risk transactions and work with customers and their accounts ensuring maximum security in order to minimize loss through fraudulent transactions.,5
"Strong CPG company, excellent brands and management","small, big company focused on maximizing the value of its brands by focusing on consumers solid leadership team supportive of individual development success requires delivering results and networking to stay relevant among peers",5
Best training ground ever,"Walmart headquarters is the best training ground or boot camp for anyone seeking a career in Marketing or Retail.  They invest in their management's growth and it is one of the few organizations I have experienced true Leadership.  Diversity is embraced at all levels.  Has a fantastic yet unique culture, which is not for all but if you embrace it you can go far in your career and learn many things.",5
Productive,Wonderful co-workers that would help you with anything you might need.  I learned a lot about my personal growth in this position.,4
Job Work/Life Balance,"Accounting, looked up invoices and made sure we got paid was the amount of inventory received at stores and if not then I would have to file claims.",4
Post Audit Recovery,A lot of hard work with great rewards. Takes a while to learn the job what it contains what is acceptable and what isn't. Your coworkers are a lot of help.,3
I was treated fairly,"I enjoyed my 17 years with Walmart.I retired to spend more time with my family and to start my own business which at this time has not gotten off the ground",5
good work place to work,"good work culture i liked it a lot.good place to learngood culture good environmentperfect place for career growthmanagers are cool",1
Fast paced enviroment,"Enjoyed coming to work, everyday was a challenge, people were nice and fun to be around, Insurance could use a upgrade, pay was average.",4
Is a fun work place if you are under the right people.,"All of my co-workers were great. We would to try to make our day great but at the same time get the job done. I and others did not care to much for some of the meetings that we would have that would involve other departments but nothing to do with us cause it took out of our time to get our work done. The most enjoyable part of the job was what I did and being around people. I am a people person and love to help them.",4
Good first job,"this was a perfect first job for me. its simple and easy, and you get a pretty decent paycheck for a 16 year old. i really enjoyed my time at subway and had a great manager and coworkers",5
Great Work/Life Balanced Company,"Good cultured, great work/life balanced company. What I learned while working there is irreplaceable and will keep dear to me. My co-workers were great and worked very well with each other.",2
"Fun Working with Table Tennis , Indoor Cricket etc",It was a beautiful environment at work and I have learned a lot from my colleague. The management was very helpful in every thing . The most enjoyable part of the job was the culture and the environment .,4
Good work experience and instant problem solving techniques etc,My work  looks  quite well with around 7 Developers where I learned Angular JS techniques and D3 javascript framework and some of building tools like maven to build the code etc.Coming to my coworkers are helpful to each other that I have seen and the hardest part of the job is time constraint and enjoyable part is learning new things in each every new tasks in implementing and facing the challenges,5
Sap abap,SAP ABAP...I'm happy with the work environment. Its challenging but at the same time rewarding. We've a big landscape and global support.,5
Recently renovated workplace makes it a great place to work and gain enterprise experience,Recently renovated workplace makes it a great place to work and gain enterprise experience. Diversity and work life balance is great as well.,4
Great place to work,"The job is the most difficult and the most rewarding.  Changes is a frequent as inhaling and exhaling.  There are days when you have to hold on.  With the many changes cones opportunities. It is all about your attitude and your ability to be flexible and adaptable. I always felt a drive and push to do and be better in any area I work",5
Good place to learn and grow,"It is unlike any place you could work for.  There is no such thing as a typical day.  Its an adventure every day.Keeping up with so many changes can be a challenge along with understanding all the acronymsThere is a lot of fun to be had. We work hard and we play hard",5
Strange organizational culture,"If you have been a manager of people at any organization, throw whatever you know out the door.  Walmart has its own lingo, strange review practices for its associates and even though they talk excessively about a work/life balance, there is none.",3
Great company to work for,"Great company. High focus on customers, employees, Ethics. Goes extra mile to ensure every day low cost and low price. Company has a great future.",5
Corporate office setting,"This company is very cost conscious, but  tends to promote from within making it a good opportunity for advancement in all areas, even in the retail stores as well.",3
"Great company with great people, an above average environment!","Great people to work for. Learned a lot about customer service and retail business. Gained a lot of replenishment skills, management skills, merchandising skills. Management was top notch & co-workers were all very friendly, fun, & helpful. Worse part was when it was really busy, it could get very hectic & physically & mentally rough, but was not anything unbearable. Best part was dealing with customers and co-workers 7 making them happy!",5
Many opportunities if in the right team,"meet and build great relationships with tenure associatesmany jobs, great associates and gives back to the communitylittle flexibility to work from home, some areas do no promote within",3
Great place to learn and take advantage of new opportunities.,"It is the largest company I have worked for. I don't mind the size, it is just easy to get lost in the world of things here. There is plenty of opportunity to grow in different directions. I moved here in December, 2010. I am looking to move back to the area where my family and friends live. I will be happy to provide further information at your request.",3
I have only good to say about my working experience at Walmart.,"I worked at the Corporate Office and I very much enjoyed my years there.    I worked with and supported as needed, a variety of teams under each of my bosses.     I love the company and what they stand for, and the majority of people really believe and try to bring the best price and service to the consumers.",5
Great opportunities,"Walmart has wonderful people and great opportunities to grow, learn and develop a long-term career. Working in the IT division proved to be both interesting and complicated. I felt continually challenged to learn, but the people were very helpful and more than willing to share their knowledge.",4
great place to work strait out of school but not a career building place,"Work life balance is not family friendly.Constantly fixing or band aiding broken vendor written code.Was a good place to learn and grow.Management only focused on rewarding groups that wrote the GUI part of the applications. Middle-ware and OS teams where never rewarded or recognized.created a lot of lifelong friends great team atmosphere. The worst part of the jobs is being on constant pager.",2
Great place with good people and lots of job options,I would stand at my scanner after having our start up meeting and streaches. i would take items and verify them on the computer for what it should be. if it didn't match up or i had any issues i would take it to a manager. i learned a lot about what goes on behind the scene at Walmart when an item is returned. Most all the co-workers where nice to work with and we usually had a good time working and talking. Pretty much everyone was always helping others out with lifting or any questions others had. the hardest part was lifting heavy things and learning the system. the Managers were very kind and understanding. even when one got in some trouble.,4
good work place,"supportive management with good friendly team lead, we had very fun when we get free time and coming to project time we had very serious to complete work in time",5
A good place to work with a lot of opportunities,Walmart has a great culture and a lot of employment opportunities. They seem to care about their employees. It is a huge company and sometimes it seems amazing that anything gets accomplished.,5
It was just okay,"I've had three different positions at Walmart. I really liked the first two. I had control over my work and workflow. I got to learn about new computer systems. However the computer programs are all really old, like Microsoft Office 2007 old. At times, it can be really confusing. The rules and policies seem to change depending on the vendor.  For example, we will do X for this company, but not another company. There is a huge difference in how hourly and salary people are treated. The benefits are not the same. There is less opportunity as an hourly worker. This creates resentment in the workforce. So the thing I really liked about Walmart is how co-workers and other associates are willing to help you. I loved that. They do not want to see you fail. They are willing to work with you to get the job done.",3
"Great workplace, High Integrity, Development opportunities","Working at Walmart Global Shared Services was a wonderful experience. I started as an hourly associate and worked my way up to management. The leadership within the organization is very driven to creating an inclusive, fair, and ethical workplace. Work-life balance was stressed as being very important, families come first. Walmart believes in accountability, personal development, and integrity driven decisions. I felt that my ideas were welcomed and taken into consideration when my department was faced with challenges. I would recommend Walmart to all of my friends and family as a great place to seek employment.",5
Poor Work Life Balance,Expected to to the jobs of 4 people.  Management is poor and associates are expected to work in a Fire-drill environment..,1
"Demanding work, very cost concious","Culture and relationships are very important. Very demanding atmosphere and meeting productivity goals, at minimum cost and few tools, a great concern among managers.",3
Great Company,"It has built the best scrum team in order to achieve the work segmentation and incremental releases that is necessary to  beat the timeline .  It has always believed In successful implementations.",5
super fun work area,I get to meet people from around the world everyday and I get to be apart of the ground floor of new trends for women across the world.,5
A great place to advance your career in the retail industry while making a difference,"You will definitely do different things on a daily basis, so if you don't like to do the same thing over and over, this is definitely a good place to advance your career. In addition, the company has a great culture in which EVERYONE is supportive and are willing to go above and beyond to make you succeed.",4
Great company overall,"Great leadership team overall.  But, as with any large company, some inefficient managers manage to stick around because they can hide among the masses.",4
Wal-Mart,"Wal-Mart gives you a lot of opportunities.  Meet a lot of new people. Learn Marketing/Sales/Retail/Finance/International Market",5
Good working place,Good place to gain considerable experience within short time. Arkansas is dull but work is fun. Mixing fun with work will be more helpful for associates to have positive experience.,4
Low to Middle income.,"The job doesn't pay much, but doesn't expect much either.  The hours are strict and structured with constant supervision.Great insurance.",3
Corporate office setting,"This company is very cost conscious, but  tends to promote from within making it a good opportunity for advancement in all areas, even in the retail stores as well.",3
N/a,"Crisis management,High turn over no quality of life no balance example would be new store has had three new store managers in less then a year the entire asst management team has been turned over twice and all dept managers have been turned over once",3
Closed in and Dull,Typical day is sitting in front of a computer looking at blue walls and blue cubicles. I did not enjoy the lack of fenestration and character of the many sad faced employees currently working there.,2
Worlds largest retailer,Was employed for 26 1/2 years with Wal-Mart.....the company has changed a lot.  Had various classes & have several certifications,3
A great place to grow,"You can change careers several times and never leave Walmart. A great place to grow. If you are willing to work hard, you can move ahead.",5
great place,"great place to work,  nothing bad to say, just had to move on got burned out of retail life.  Wanted to change careers while I was young enough to due so.",5
New rewarding Career,"Looking for a exciting and challenged  work environment, where I can develop new skills and use them in my daily tasks and responsibilities.",5
Great call center,"Walmart benefits has been a amazing learning experience and growth opportunity. Walmart's benefits call center has given me more knowledge, and opportunity than I could possibly have asked for.   The work day gives me the chance to work with and assist Walmart associates in selecting the correct health, vision, dental and supplemental benefits for our associate to ensure that they are enrolling in the coverages that best fits their lives and personal situations; by educating our associates in regards to walmarts company benefits. The most onerous aspect of the job is the amount of information you must retain, or knowing what resources to use to find the answer to a particular question.    The most rewarding part of this job is helping an associate with something they felt was otherwise impossible to resolve.",4
Individual development,"Company with values and focused on individual growth. Diverse career growth opportunities within the company Examples of my work include:• Drove successful launch of Modular Process Tracker tool by working a talent team, defining process development plans, and leading implementation to achieve client satisfaction comprising of Merchandise SBU’s with Walmart Home office.• Completed Lean Six Sigma Green Belt Project for Sam’s Club Preopening by eliminating paper checks and incorporating Credit cards for Sam’s Club managers performing membership drive on the club front. Resulted in mitigation of $3.4M financial risk associated with blank paper checks and elimination of $12,247 manpower cost per year. Achieved Zero defects and Six Sigma for the project.• Proved vital to reorganization leadership that cumulated in success of Merchant leadership program (MLP) by supervising training managers.",5
"working as Sr ui developer in wallmart ,it was good good place to worki learn new things","ui developer , html css5, java script below tool i used everything thisng is good , nice place to work and learn more new technologies",5
Good place to get your basics of Networking,Good place to get your basics of Networking and how to operate in a fast past administration. Worked on the Distribution Centers for Wal-Mart. I enjoyed the co-workers I worked with. Management was ok but there were too many road blocks to get anything done.,2
Walmart is a great company.,It is a great company that I would recommend to almost anyone who is willing to work hard and go above and beyond. There are new opportunities every day at Walmart for just about every level of education and experience.,4
Diverse culture with unlimited sources of new technology,"Wal-Mart is a technology driver retailer.  There are limitless amounts of new technologies (always growing) to learn.  If you are highly motivated and desire to be on the bleeding edge of Retail and Security Technology, this is a great place for you to gain valuable experience. Wal-Mart is very fast pace and expectations are high, even at an individual contributor level.  The experience gained is invaluable.",4
Very caring company,"Company that you can tell Cares for its employees. Career path set in place to assure you move up in the company. Several opportunities for lateral movement to ensure you are where you belong to best fit yourself and the company. Stress that home is more important than work",4
This is a beneficial place to work for,"Beneficial place to work for and if you have the right knowledge your advancement is ideal.I have learned numerous thing about accounting and how this company runs. Management is great and very willing to work with you and understanding.",4
I greatly enjoy working for Walmart.,"I have been with Walmart almost 7 years now and I greatly enjoy working for them. My ideal career path is to continue work in training and development.  My strengths in curriculum development, facilitation and rapport building lend insight into designing and delivering effective and enjoyable training. I am passionate about Training and Talent Development, and I would love to continue educating and inspiring others.",5
Productive and fast moving project,Experienced lot In Angular.JS and learned a new javascript library D3.JS. My co-workers are very friendly and helpful.,5
I windowless building and work that sucks to life from you.,You are on the phones the taking complaining customer calls that you cant help if you go over your scheduled break time due to was on the phone with the customer you are threaten with a write up. Bad place to work and the Management has no compassion and easily showed favoritism.,2
Decent,"Typical day at work is counting merchandise for inventory.I learned how to count stock items and face shelves.Management is very strict.Coworkers are amazing.Hardest part of the job is meeting time limits and requirements.Most enjoyable part of the job is working with friends.",4
Great company!,"•	Worked with buyers to manage $4.8 Billion candy and tobacco categories by identifying opportunities and building analyses to understand the state of the business.•	Studied business activity, assist with managing inventory, and provide updates to merchandising team with data derived primarily from Retail Link and analyzed using VLookUps, PivotTables, Macros, etc.•	Maintained relationships with suppliers and assist in negotiations.•	Delivered feedback to the field regarding store-specific inquiries.",5
