Summary,Review,Rating
Walmart Technology,"The recent push on the technology front at Wal-mart is a great start for the company, but it still has a long way to go. The company as a whole needs to get out of the mindset of using legacy applications and infrastructure. They need to understand that in order to grow, money must be spent and trying to do things the cheapest way possible isn't going to lead to the kind of growth that they need.",4
Great job good managers,Walmart is constantly trying to improve ever aspect of its business. You have to be able to adapt. They work with you to create a good work life balance.,5
Depends,"Overall the company is good to work for. But, it depends on what department you work in. Depends on the level of your manager and if they are willing to grow you or not.",4
Continued Layoffs,"I love Walmart, but recent and continual layoffs are causing a great amount of stress.  I have worked for the company almost 18 years and now I am looking to find outside employment before I am displaced.   Walmart has an ethical environment and really does try to reduce costs to pass along to our customers",3
Not the company they used to be.,Walmart has changed the focus from a family retail company to forgetting how they got to where they are. The Walmart employee is expendable. Unrealistic work/life balance.,2
Worthwhile company with good benefits,"Worthwhile company with good benefitsBalanced workforceStock options and 401kMedical insurance available Nice fitness center available at a discounted rate",4
"A typical day was rush, rush, rush.  Always more work then one individual could complete in an 8 hour period.","I received education in Retail Link, excel, excel, PowerPoint and all their proprietary programs.  There was always more work than you could complete in an 8 hour day.  Management pushed their responsibilities off on the support staff but took credit for the work.",3
Wal-Mart Account,I just worked on the Wal-Mart account. I really worked for Americal and traveled to Wal-Mart. It was a interesting job and I enjoyed working on that account.,3
Great Company,You either love corporate world or you don't. Walmart is a wonderful company to work for. I recommend my friends and family to work at walmart all the time.,5
fun workplace,"the work itself can be stressful (rushing from location to location and keeping everything straight as you do it), but once you have been there for a bit everyone starts to treat you like family.",4
Changing culture,"Working at Walmart no longer offers any more stability than working for a vendor.  Compensation is pretty nice and heavily focused on performance.  Current turmoil exists in getting a clear vision from the top makes it hard to know if you are doing what is expected.  Current struggle of power between Bentonville and California is tiring and creating a lot of busy work that keeps you from focusing on goals and things that you will be evaluated on.  Because of this and because of the culture shift, work/life balancing is also fading.",3
Walmart Legal Department,"The Walmart Corporate Office is a great place to work, but don't count on being there long term.  Once you think you know what your team is set to accomplish, the team is eliminated due to company reorganization.",3
very professional atmosphere,"Very high paced, always work to be done. Very good management team, and fun place to work. You can stay at Walmart HO for a long period of time because there are so many jobs you can transfer into.",5
Corporate office setting,"This company is very cost conscious, but  tends to promote from within making it a good opportunity for advancement in all areas, even in the retail stores as well.",3
Nice,I enjoyed my job and the people that I worked for. Love the opportunities that were given to employees in corporate offices to further your education.,3
Productive,Great place to work. Not every team or leader is the same. I only wished there was more options to work from home for associates that do not come face to face with a customer.,5
Very structured large company,Small fish in a very big pond.  Education and experience often trumped by seniority and EEOC status.  A very political environment; very competitive and cut-throat.,1
Workplace is a little monotonous but a good group,"I work with a pretty good group of people. Personal opinions are not very openly shared for fear of persecution but as long as I keep to small talk, everything is fine. The work is monotonous but there is plenty to do and if I happen to run out of work, I can take advantage of the many courses offered for free through the company.",3
lots of sitting...,"The people I worked with were usually pretty friendly, some people just wanted to play around all day.  Sometimes you were set to meet impossible standards.  Other than that it was great.",4
Greatt Employees Alot of bad policies,I loved working with all the employees there some were back bitting employees doinganything to get a better job or a job they didnt have to work so hard for but most of the employees were hard workers.,4
Lots of opportunity,Walmart provides opportunity for those who seek it. There are so many different teams to work on and roles you can hold. Networking and building your relationships is an effective way to learn about new opportunities.,5
Collaborative workplace,"Collaborative WorkplaceGreat CultureLow on job security Fair comp and benefits Great work live balance Decent leadershipFlexible hoursCareer Opportunities",3
Depends on the location you work,"Each store operates differently. Being close to the home office makes it a stricter workplace with insane amount of drama. Management does not bother to remember your name and will make you work outside of your job title, especially with maintenance. Do not be afraid to transfer to another facility for your own personal gain.",3
Better than Average,The Company as a whole has a lot more positives going for it than the segments of groups/departments that seem to project and promote a cut-throat culture. Such activities and behavior should be identified and snuffed out - to ensure the long term success of the business.,4
Career Stagnate,"It's hard to describe a typical day for Walmart as all positions are different from hourly to salary. I've been lucky enough to hold both types of positions. With the ever changing environment that Walmart holds, you have to be adaptable and go with the change. One of the hardest things to do is accepting the constant change and the stress that comes along with it. I've enjoyed my time with Walmart; however, I've reached a point in my career in which I've become stagnate and there are not enough opportunities for me to continue my career in the field in which I am passionate and knowledgeable about. Thus, I am now having to resort to looking outside of the company for continue career growth and opportunities.",3
Great place to work,"Great enviroment, good pay and benifits, friendly staff, a lot of job options with room for growth, additional education, flexable hours and paid time off.",5
Store Design,Variety in making Auto Cad design for different store with different needs. Entry level management position so you have to have people skills to handle different personality types,4
The Inmates are running aslyum,"Worked there for 10 years and in the end it was very laxed. We had associates with over 15 absences but still kept their jobs. It was almost like we had to say pretty please come to work and do your job.I agree they should pay more and it return maybe they will get better workers and results.",1
I wouldnt recommend it,"It gets too personal there. Its hard not to get too invested in the time and stress there, it wasn't where I'm supposed to be. The people are awesome though :)",3
Wal-mart in the 90's,We felt like we lead the world in retail. This was before online retailing really took off. Our Information systems was lauded as a world leader. During recent visits it became clear that WMT ISD is decades behind now. A relic. Ossified.,3
My Opinion,Wal-Mart is a big company that is very successful. They work hard to improve every year with the help from their employees. I started almost 5 years ago. Every year there are layoffs. The amount of pay has stayed the same and the company keeps increasing the amount of sales every year. At the shareholders meeting they announced how well the company is doing. Another 1000 associates will soon be let go. A great company but a terrible company to work for.,3
Fun place to work with,First place of work where I was provided with point of sale learning and development skills. Provides all tools and equipment that help developers get to speed and understand more about the product.,5
Excellent place to work with wonderful people,I was able to get work done competently and quickly and was given constructive input by my piers and those above me as to better fit their needs. The work environment was great and allowed me to exit to get lunch or a snack or take breaks as needed or desired.,4
Very stressful working enviroment,I worked in a call center for 3 years. I loved my management and my team in my office but the job itself was very stressful. You had to be glued to your desk all day and the turn over rate was insane.,5
Corporate office setting,"This company is very cost conscious, but  tends to promote from within making it a good opportunity for advancement in all areas, even in the retail stores as well.",3
Great company,"Good work like balance and a lot of fun. The company offers a ton of family oriented activities, great for a developer with a family. This company offers a lot of horizontal and vertical moves.",4
To long ago,"I cant give an accurate rating. As I have not worked there in more than 10 years. What I do remember is a continued effort to be innovative, and a great culture.",4
A Day and A Life as a Walmart Manager,"Walmart was an amazing place to work for 20+ years ago, however, with change in leadership comes change in the people. The Management team is the worst that I have ever seen and really should be taken a look at and revamped. Walmart is bringing in MBA's to fill middle management positions and that's great except MBA's don't have the exeperience of the middle managers that get getting let go in the reorganization of the company. I hope they figure this out soon before they lose all of the good leaders.",1
Best place every,Best job every. Very fast paced and demanding. You will earn your paycheck. You will be called if you can preform and you will be rewarded for hard work and dedication.,5
Review from a Contractor (NOT an employee),"To be fair, I will clearly state that I was a contractor and not an employee on Walmart's payroll. I worked in the department adjacent to Sales, so I heard telephone conversations from our cubicle that caused me to have an unfavorable opinion about how they do business. The culture at Wal-Mart is extremely competitive. They demand exclusivity from those who would like to do business with them, insisting that they NOT sell to their competition. If that was not agreed upon, then Walmart would not agree to sell their product.",3
Great company to me for 20 years;  Insecurity with the future,Great company but a lot of layoffs the past few years and now mandatory performance evaluation curves in IT.  Feels like goal is to prevent future layoffs and associated costs.  Instead the new approach is to proactively fire associates through performance management initiatives yet these are curve/nbr based leaving some people vulnerable who are actually doing acceptable work..,4
Sr Project Manager,"A typical day for a Sr Project Manager is development and support. The atomy to be adaptable, very strong critical judgment and decision-making skills. Key competencies I've learned and developed:Drive change adoption on new development and processes, by leading change management understanding company initiatives and business needs. Ensure business continuity, by providing merchandising support thru best practices, consulting, troubleshooting, system Issues resolution, crisis management, training, etc.  Culture Champion, by being customer-centric, optimizes operating models across functional teams and instill change management.Excel in customer service by using professional and impeccable judgment.  Identifies and uses facts, information, and expertise to set priorities and make informed decisions.  Building and Developing Talent, by associate empowerment through merch model and ensure the organizational structure is optimized for efficiency and resources are aligned to maximize deliverables. The hardest part of the job is the politics understanding your customers and leadership ensuring all communication is clear and concise. The most enjoyable part of my job has been the ongoing development, ability to learn multiple systems, and networking process.",4
Great company to work for,Excellent company to work for.  Work environment vastly differs at the store level versus the corporate level.  Company culture is stronger at the store level,5
Great Company,"Usually long hoursCulture is typical corporateMore flexibility in workgreat benefitsHard in change managementGreat leadership - Not a great location compared to big cities",5
Poor management,"Walmart when I worked there had poor management, very high turnover rate, pay scale was horrible for what they expected you to do. Co workers were friendly",2
Stressful,"Depending on your level in the company, stress can take its toll. I was never asked to breach our ethics code, this is a big plus to me. With their PTO system, you chose your holidays!",4
Walmart is a great place to work and they listen to thier employees,A typical day at work is spent analyzing programs for problems or creating new code for programs.  Management was very supportive of any technical training needed.,5
Fast paced and competitive,"Great company, well rounded and provides many avenues for job choices. Need to streamline job placement for incoming and current workers to find the ideal job.",4
12 years,"After 12 years with the company, feel they need to focus on mid management, training on leadership, engagement and ensuring compensation plan is fair for those who have multiple units and markets to manage.",3
Culture Matters,"The culture at WM matters very much. But the culture does not adapt. Men are very much in charge. As a woman, I was able to advance, and it was supported, but I was constantly coached to not share my knowledge. Other women who were successful found innovative and adaptive ways to get their ideas across. It's an exhausting battle to keep up, but there are those that can and do succeed. As a culture, education and outside knowledge while verbally asked for, is professional suicide when you try to persuade others to think differently.",3
Profitable Business,Walmart makes over $50 billion per year so you would think that they would have a lot of job security but with Amazon taking market share they must stay nimble.,4
If you like helping people solve problems this is for you,A fast paced work environment with career advancement potential. If you like being on the phone and resolving conflict you might consider this oppertunity,3
Leadership Summary,"Most senior level leaders spend majority of their day in back to back meetings, most are non-productive with no agenda or meaningful outcome.  In the past three years, most of the leadership empowerment culture has been removed, resulting in delays and lack of value and appreciation for experience.  The company is transforming to a command and execution reform vs. one built on talent and expertise.",1
No room for promotion unless you are doing the job already.,"No room for promotion unless you are doing the job already.. They don't care much for you, just that the work gets done and aren't willing to hire enough people to cover the workload. Managers are mostly nice. Culture in other departments appears to be nice as well.",3
Fast paced  and focused culture,"Good benefits.  A typical day at work was full of meetings, going through lots of emails, phone calls, connecting with other departments to understand needs and direction. Outside connection to communities and businesses was also very important to my day. learned a lot about focus, commitment, listening, being creative, innovative, selling, being vision and mission driven, understanding supply chain and sourcing. finding savings. internal connection and helping others realize that we were on the same team with the goal of delivering savings, value and great customer service. making a difference in businesses and communities that we signed contracts with and that we served.",4
Corporate office setting,"This company is very cost conscious, but  tends to promote from within making it a good opportunity for advancement in all areas, even in the retail stores as well.",3
2 out of 3 isn't bad,"I've been a Walmart associate a few times over the past 18 years now, and these last 2 times have probably been the worst experiences I have ever had. Lack of training, absent management, temp associates watching Netflix instead of working but nothing being done about it, as well as signing a 1 year contract and being able to be let go just whenever (last time was 2 weeks after start date after working 12 hour shifts over the Holidays) Not a company I want to be a part of anymore.",2
Walmart Logisitcs,Walmart laid off people with no reason and rehired people at a lower pay scale to offset budgets. The large layoffs affected all even with good performance evals. The right thing to do is let people who want to take a severance package and then move out the people with low evals.,2
My opinion,"Again, I find these questions offensive in some cases and invasive in others.I question the legality of your company asking them, regardless of any small print.",3
Changing Environment... but for the better or worse?,By making everyone uncomfortable with constant layoffs that have no basis on which people and why it causes people to leave on their own with no need for a severance package.,3
Mentor Program,I love that Walmart offers a mentor program. Associates are given the opportunity to pair up with an associate that works in a position of their dreams. They work one on one with you to help you get prepared for the future career that you want.,5
Walmart transitioning to a different way of working,Great people with positive attitudes.  Every profession available within the company. Never a dull moment.  Family environment.  Expanding markets internationally.  Global company.,3
Company Heading Downhill,Walmart has lost it's focus as a retailer.  Lately it has been buying up smaller ecommerce companies in an effort to compete with Amazon while also restructuring it's organization to pay for these acquisitions.  As a result there's been a huge talent drain within the organization through layoffs and associates leaving for other companies with more stability.  I would advice prospective job applicants to be cautious before accepting a position with Walmart.,2
Great Resume Builder,Great to have on your resume. They turn over 100% their replenishment teams every two years due to the work environment. Pay is not that competitive to industry standards and what suppliers in the area pay.,2
stressful but nice people,"It was my very first job so and i had to move to arkansas for it so its more me at fault for putting so much stress on myself, but the people were nice enough.",4
Great place,"WMT helped my career take off so well and I'm very thankful for everyone I met there.  You do move around a lot, but meet great people along the way.  I would do it again.",4
Great for entry level,"Walmart ISD is a great place to get experience in technology.  The cons outway the positives though.  Walmart is micromanaged and it's not how you work, it's who you know.  This has been the only company that you have to fight to keep your position.  They also give raises to people based on who they know, not if they are qualified.  There is favoritism based on who the managers like.  Sam Walton created a great company that has now become a cesspool of micromanagers who base your performance on if they like you. They will also break procedure and call you to fire you  The beliefs that Sam Walton founded Walmart on is no more.",1
Is a good company with a lot of good people.  Provided great experience and growth.,Walmart is a good company that provided some incredible  experiences for an individual to take advantage of.  It can be a little over-structured but you can feel comfortable speaking to executive leadership.,4
Great Opportunity,Love working from home allows for ability to work hours that i choose but desire more stability.  i miss working with a team.  i love the team dynamic and learning new skills.,5
Bad work environment,I worked almost 8 years at walmart and i never had any problem until the last month there when new CSM was hired and she was a total witch. She told lies about me to management . I was never treated so badly at work until she was hired. She makes it miserable for some select cashiers. Needless to say management took her side and i quit. Some of the managers and assistant managers i worked under were bad.,1
The atmosphere was second to none.,I really enjoyed how you can get the corporate lifestyle but a nice laid back productive atmosphere. I was thoroughly impressed with my experience over the course of the summer.,5
Sometimes boring,Some of the locations they put you in for security are boring and there is no one to talk to. They expect you to just sit there at times and not pass time with a phone or internet.,3
Unbalanced work life balance,"Many daily meetings, need to consider work life balance of  their associates. Unreliable for advancement  or longevity. Mangers are in need of management training.  Some manager's have no expierence in people management.",2
People are hard working and dedicated,I spent most of my adult life working there it was all I knew and now I am starting over looking for something fresh and new. Ready to hit the ground running.,4
Productive,"Walmart is a great place to learn new things and meet new people. Wonderful work industry. Culture is great, managers are able to cooperate with flexible work hours.",5
"great corporate experience, learning lesson","could be a rewarding experience under the right leadership.  It is a family atmosphere and caring individuals to work alongside, but business is business",4
Corporate office setting,"This company is very cost conscious, but  tends to promote from within making it a good opportunity for advancement in all areas, even in the retail stores as well.",3
"Good place to work. But, in something of a state of flux these days.","Working to modernize their work environment. Much progress made. Still some work to do. But, they recognize the need to be attractive to younger, innovative talent.",4
The best company I have ever worked,It the number 1 fortune among 500 companies.I worked in bentonville in Arkansas state which is the head quarter of Walmart proper work life balance I had found in the company.,5
Relaxing but fun.,It will never get boring if you associate with the right people. It’s a great environment to work at. There are some boring days but those are the days you would enjoy since it is so relaxing.,4
Great place to be,"While the pay was on the lower end, the opportunities at walmart for career advancement and learning were great.  I would go back to work for them if they made a good offer.",4
My experience,"Overall, I had a good experience. I enjoyed my co-workers. The work environment was nice. Everyone is nice and easy going for the  most part. It is definitely a job that one should be prepared for.",5
Favorites get treated better,"Top heavy managers. Micro-manageing constantly. Wrong - doers are not held accountable. No ""respect for the individual""  as said in their own training.",1
Demanding Job,Walmart is a very hard company to work for. Worked for this company for 15 years. Then Due to restructuring I was displaced from my Job without any prior warning.,3
Remember loyal associates,They need to remember the associates that helped build the company and look to retain them not displace them. All companies need new blood but they also to need to retain the older associates that are already trained and can help to train the new associates. When they do a structure change they are displacing the older associates for the newer associates.,3
Long term associate,I worked for Walmart for 25 years and was displaced by them in March 2018.  I held several position in my 25 year career.  I've had good managers and bad managers in my career.  I've supervised associates as an hourly supervisor.,3
Fast paced but rewarding.,Could be very stressful at times which brought down my overall score. The company was generally fair and always provided me with opportunities for advancement.,5
great place to work relaxed wnviorment,"Relaxed environment great benefits, They promote from within in the call center and the stores. They have a mentor program to help the associates along in their career. they encourage cross training the statement is for Walmart is you do not have to change companies to change carriers.",5
Decent temporary assignment,"Friendly people, brisk pace and workload evenly distributed throughout team.  Each team member responsible to accomplish daily goals set by team leader each morning.  Clear, concise instructions accompanied the intended outcome and expectation for each assigned task.",3
