Summary,Review,Rating
Corporate office setting,"This company is very cost conscious, but  tends to promote from within making it a good opportunity for advancement in all areas, even in the retail stores as well.",3
Good place to work!,"After 26yrs, am happy with Walmart over all. Good hours, great benefits. Can move around with in the company. Management is good to associates. Great community involvement. ",5
High pressure retail.,You can move up or move out quickly all depending on whether or not your market manager or regional manager like you. One visit can change everything for the good or for the bad.,2
Heavy on tech – light on training. ,"Was saddled with a “trainer” who did not like training. Job went downhill from there. Was promised M-F, 8AM-5PM schedule, but after training got scheduled for weekends. When the pandemic hit, everyone started working from home. A year and 4 months later, when Walmart invited everyone to begin transitioning back to the office, our team was told we’d be working from home permanently. Great if you’re an introvert or don’t like being around people. Awful if you’re an extrovert or enjoy being around people. ",3
Customers,Customers tend to treat us like we are a second rate telemarketing company which we are not and can be rude and hateful and blame all their problems on billing Dept even if it’s a delivered order that was stolen from their home or bank issues that are not our fault. You must have tough skin to handle this job. ,5
Wealthy Company with a Poor Culture,It's somewhat difficult to explain but this company just can't figure it out at the corporate level. From mediocre salaries to old processes. Imagine a Tesla exterior with a Ford motor.,3
"Depending on your leadership, you can do extremely well or get railroaded out. Both happen just as quickly.","It's typical retail. There is a ton of upside if you get the right managers above you. There is a ton of downside if you get the wrong managers above you. The market managers and regional managers control your entire destiny based off of a couple of visits. That part is the most disappointing, but on the flip side, those couple of visits can catapult you to the top as well if they like you during them.",3
It’s far from okay,Definitely seems like there’s room to grow but you will constantly be overlooked for different positions and advancements. It’s really sad that a company that is so large has such little room for real growth,1
Something for Everyone ,Large company with a ton of room for advancement based on where you want to go. Family and work balance has greatly improved over the years and that’s a significant benefit ,4
They care about their employees if you need time off you can take it And that means everything,Busy all day makes the time go by super fastManagement is great and very helpful in learningReally the hardest part about my job is just showing up that’s it and dealing with grouchy customers from time to timeThe people there are great,4
Good pay and good benefits ,Worked in the home office for 4 years.Environment was good and pay was fair. Management is not always helpful as they sometimes don’t know how to adept to each person differently. Job security isn’t really there since they do lay offs so often.Overall good place to work just remember you are just a number. ,4
I had Terrible Manager ,"I was very excited to get a job in the Health and Wellness division and made some great friends in the field. But I wanted to advance and work in Optical, not Pharma where I was hired. After working for a year I tried to move over to Optical but my manager wants me to stay in Pharma and would not let me move. I am moved on and move away from Bentonville Arkansas but I would not recommend anyone go work there and move their family there for a job as they have a high turnover in senior management at the home office and because they phase your job out. This did not happen to me but to many of my friends. ",2
It's a great place to work,"Good pay, work life balance. There are some inconsistencies in work from home policy. Associates that have worked at Walmart for a year+ are not allowed to relocate and work remote, but some new associates are getting hired as remote. Feels like California employees get special treatment over Bentonville Associates.",4
You get to solve the largest technology problems in the world ,Great company with high expectations and the ability for anyone in the company to get to any position. The technology group is fun to work for and has a culture of continuous learning. Be prepared to work long hours as the company is transforming. ,4
Love it!,"Walmart managers are the best I've ever worked for. I have been through 3 management transitions and every manager was concerned about my happiness, stress levels and professional development",5
"Great culture, professional development available, amazing benefits",Best managers ever! I've been through management transition 3 times and all have been some of the best managers I've worked under. Walmart strongly encourages professional development and provides the tool chest and coaching to do so. ,5
Productive driven,"Flexible work schedule in some areas. Good teams if you can find your spot, but they don't want you to stay. They want you to improve your skill sets but also wants you to have daily task completed, no wiggle room.",4
Mixed Bag,The pay is competitive/ better than competitors. But non financial benefits are a more expensive and management does a poor job investing in their team ,3
Good place to learn,"Good place to learn about merchandising, retail and eCommerce. A bit impersonal as many massive companies are, but the flip side is there are massive opportunities to grow. Bentonville Arkansas is tough, but if you can get over that the pay is good and there are plenty of opportunities.",3
"Hard work , good benefits , high turnover.",Long hours and short breaks. Pay and benefits are all decent . The retention rate for new hires at these warehouses is incredibly low; don't be surprised if multiple co-workers quit sooner than you.,3
Horrible politics,"One person does 10 peoples work. They hire people in India to cut costs which means you are working in 2 opposite time zones. You can work your tail off but dare you rub someone the wrong way by even expressing an opinion that is different than yours and you can say bye bye to your job. The only good thing is work from home otherwise the work hours are ridiculous, politics is insane, culture is toxic and leadership has very fragile egos.",1
Corporate office setting,"This company is very cost conscious, but  tends to promote from within making it a good opportunity for advancement in all areas, even in the retail stores as well.",3
Well paid but stressful,"You work on huge programs.  Direct managers generally are pretty good.  Hit or miss on the VP's, but executive leadership is pretty great.  Pay was good, but you pay for it through hours worked and stress.  I liked my colleagues.  ",3
Good transition job,I worked for Walmart information systems for a couple of years. I will state the pros and cons Pros:1. Big projects with huge ROI2. High maturity when it come to information systemsCons1. Pay is average or below even for IT Professionals. Consider the amount of out of pocket that you have to pay for healthcare2. Horrible health insurance. Walmart has catastrophic health insurance where alot of things are not covered. The premiums are not cheap.3. Alot of bad politics especially from management. 4. Expect to be laid off at anytime. Layoffs at headquarters happens very often for restructuring. The emotional stress is not worth it,1
Great Opportunity,Great company to work for. Challenging environments at time but the sky is the limit on what you can do. If you dedicate yourself and position yourself with the right leadership success will follow.,4
"Poor Management, Supervisors with attitiudes, ","Working at Walmart was one of those get your feet wet type of jobs. I enjoyed it at first, but quickly came to realize that Walmart was only about their money and nothing else. The management sucks, the pay sucks, and they have absolutely no care for your health or well being, They allowed Supervisors to lie and force you to work off the clock "" or you can quit"" There were times when you were gas lighted by a supervisor and it felt like you were in an abusive, manipulative relationship with your job.  LOTS of favoritism. ",1
Typical retail,Was an ok experience for my first job. Took this position right out of school. Always had IT request backlogged and customers how were upset about wait times.,4
Terrible HR department,"Walmart isn't the same anymore. Now, you are just a number, especially if you are hourly or entry level management. They work hard to give out the false sense that you matter, and that they (HR) care about you, but in reality they don't. Your coworkers and managers might actually care about you, but definitely not HR. You can be fire out of the blue without warning, without disciplinary action, and regardless of your performance.  ",2
productive and fun workplace with lots of overtime,work as an unloader and hauler. long hours on your feet but really good pay and management cares about you and wants you to succede the best you are able to ,4
Good place ,"Good place to work depending on managers. Walmart was very fun to work at but sometimes the managers would take advantage of you if they saw you working hard. Pushed a lot and bossed around but pretty much you get to vibe alone when you're a stocker, unless there's 2 people per",5
They don't care about the people,The only care about $$$$ . If you don't make the numbers that you need to make your fired. It's all about quality it's about shoving in the numbers and the orders as fast as possible.,1
You are just a number,"Walmart may pay well at the corporate level but that’s about as far as it goes. Your dedication and time mean nothing to them. They lay off consistently and cut positions. There is no loyalty with this company. While they embrace diversity now only after what has happened in this country, they don’t promote fairly regardless. Stay away from this place like the plague. ",1
Not my favorite job,Micromanaged to death and nit picked about everything.  I liked my manager and their bosses are great but the lower/middle management team are almost impossible to deal with.  Being the 3rd party employee made me an easy target to unleash corporate frustration on,3
"Great Coworkers, ","When I started was a great place to work for, hourly's were treated great, not so great now, dont really value their long term/loyal associates getting rid of jobs.",3
Horrible backstabbing management,"I used to be so pro Wal-Mart. Now I would not recommend them.  The core values of this company are wonderful, unless you get a manager that only speaks the values but doesn't practice them.  Sam Walton would be so dissapointed in seeing what he built turn sour with the management.",2
Walmart is stable,"Good company to work for but it isn't easy, you have to pay attention and in training you won't feel ready but they will still start you so you learn more as you start working.",4
Great place to work,"Not perfect by any means, but exciting environment, an amazing culture of respect and striving to be better every day. There is so much to learn about the company's efforts to become even more competitive!",4
Fortune 1 for a reason,I worked for Walmart for 5 years and during that time I had the opportunity to learn from and meet many noteworthy individuals. Working for Walmart is definitely like being part of a family. There is endless room to grow if you want. Walmart values their employees and makes it a point to help people understand the meaning of their work beyond a paycheck. ,5
I loved the people I worked with,"The negative was you we’re pretty-judged almost right away whether or not you were promotable and once written off, you were going nowhere.  They believe in working you in areas where you haven’t been prior and that creates a lot I’d really unqualified people who don’t know areas they are managing, but overall, there were many more quality managers than at many other corporate offices.There was a great deal of unfairness there.  Two of us did the work of 4 full time people.  I sadly had to leave.",4
Fun ,"Its ok company.  They lay off constantly. Good benefits, good people. You need to know people on order to grow in this company . I had a great Boss....",3
Great corporate culture,Leadership is very approachable and my work feels purpose driven. I feel like the work I do here has a big impact and I’m proud of what we’re doing as a company. ,4
Great company,Love the management and company. Easily move up in ranks. Great customer service and strong bonds. Would highly recommend employment to anyone looking for a job.,5
Corporate office setting,"This company is very cost conscious, but  tends to promote from within making it a good opportunity for advancement in all areas, even in the retail stores as well.",3
Walmart ,"It’s a good job, just not the place it is to be when Sams was alive, but the new drivers have to slip seat a couple times a week. New drivers will be starting their work week on the weekends. ",4
Imagine having a migraine everyday but it's a store.,If you think you can keep overtime if asked to stay late then never apply. If you like spending the holidays with your family then go somewhere else. If you hate doing other peoples jobs then leave immediately. Oh and if you miss high school drama then Walmart is the place of your dreams.,1
"Good Stopgap, But Don't Stay Too Long","Three-day work week, paid workout, able to wear whatever I want, water constantly available, huge safety measures. Good pay for those looking to enter the workforce but not the greatest pay.",4
company with good culture/Reorg every so months,"Overall, great company in the 17 years I worked there I learned a lot in the department I worked in. I remember individuals who had long careers and growth. However, that has changed and like many companies reorgs are plenty. In the last 10 years, Walmart has transformed itself from a homey large company to an international giant and competitor. As a minority that helped shape the culture too, it felt more inclusive. ",3
"Weak company culture, with little integrity","Management backing is just words. When the chips are down, management disappears.  The company demands mediocrity. I have never seen a single IT person that was allowed to do what they were best at. Careers are ruined in the first three years by keeping employees away from their interests. Your skills will be atrophied and you will not be able to leave Bentonville once that happens. The pay is great. Bonuses are fantastic.  If you can justify that to sell your career down the tubes, Walmart is perfect. If you have any creativity or ability, stay away. Keep your head down and make no mistakes. ",1
You are expendable,"They have no concern for you or your needs whatsoever, they do not work with you at all and the training was often incorrect and you could not actually help the store employee solve the problem they were calling about. The people that listened to your calls and review your performance all had their own set of requirements and scored you by them so you could never get it right. ",1
Great culture and great coworkers,"Good work life balance, incredibly nice and friendly coworkers. Good budget to do the work that I want to do. Great women’s network as well. Learned a lot while working there.",5
Great place to work,Great place to work. I've been with Walmart since I graduated in 2015. Been through three promotions in 5 years. Currently working as data scientist. My manager cares about me and helps me develop. ,5
"Great place to work, but very large",I worked here as an intern in the corporate office. I really enjoyed it. Lots of fun company activities and I loved how collaborative it was. Only downside is how big the company is and the feeling that promotions are increasingly political. It’s the unfortunate reality of being such a high profile and large company in 2020. ,5
Great Training and Good Management,"I worked here for about a year, and the training is awesome. Management is good. Cannot turn down promotions. Every time you receive a pay increase or promotion, you are ineligible to apply for another position within the company for at least 6 months, so do not expect to move up fast. ",4
busy,it was always busy but that wasn't always a bad thing you're day went by fast but management was terrible and they never seemed to be on the same page with each other ,3
Average Corporate Retail IT Job,"Depending on the team you land on you can have a great time or an awful time. The sad truth is that like any corporate, your manager will make or break your enjoyment of your job. Walmart also tries to say they are agile, but often than not, most teams end up doing Agil-fall, and pretend and present like they are agile, but crumple to business users needs and it ends up a bastardized Waterfall project. ",4
Long hours - micromanagement ,"If you want to feel like you're in kindergarten and have every little thing you do be watched by management, this is the place for you to work..if not move right along!",3
Depends where in the company you work at,Some areas of business are treated better than workers from the retail stores. There is more opportunity for advancement and wage increase in the home office than in the stores.,4
Pretty good place to work,"Overall, Walmart is a pretty good place to work, and depending on where within the company you're placed, your experience may be different for the better or worse.",4
Good job but bad management,Overall it’s a good company to work for there’s plenty of job opportunities you can move up in the company or you can stay at store level Walmart even does intern for students it’s also beneficial for people who have been with the company for a while it’s 401k is a good thing to have there are benefits for the part time associates,2
Loyalty is key,"You will work with amazing people and learn new things daily. However, retail is their business so compensation is probably 1/3 of the general market value for technical roles. Annual bonuses used to make up another 1/3 of that, but they have recently changed to making the amount and receipt at all performance based, so it is no longer guaranteed. If you’re confident your manager likes you, it will probably be fine. You’ll generally be working on older stacks and unsupported versions of everything. It is very common to be reassigned to another team our department or even role without being consulted or consenting. ",3
Just Bad!,"I wouldn't recommend working here. Management is bad, they don't respect their employees. Also the salary is a complete job, you can easily get terminated without notice",1
Not bad,I started as a temp technically working for an outside agency which wasn't great because it meant I had lower pay and no benefits but once I was hired directly by Walmart my situation improved. The work at the home office can be tedious in accounts payable but it wasn't particularly stressful.,3
Quality control,"Work-life balanceYou become family, they work with you in any situation.Pay & benefitsExcellentOverallI worked there for 15 years plus 1 year at the store and 10 years at the photo lab, you can advance quickly, transfer to any job you want, lots of opportunities.",5
Corporate office setting,"This company is very cost conscious, but  tends to promote from within making it a good opportunity for advancement in all areas, even in the retail stores as well.",3
"Not a stable job, does not care for employees","Let's start off by saying Walmart treats the employees like they are disposable. Literally, rips the rug out from beneath them. Firstly, when the company changes direction (no warning just removes people from jobs). Secondly, you have no job security (none). Now let me say I understand a company changes and adapts, but they do this not caring about the people they affect. When I say affect, I mean you come into work and are walked into an office to be let go. They close stores like a hooker gets laid in New York. They take away they put back, but the people they trample on mean nothing. Want to know why because you my friend are just a number. You can be replaced by someone who will do it cheaper. It is so sad to see the Wal-Mart I used to know, turn into a greedy corporate mess. Literally Wal-Mart is a hot mess. Please just get a job somewhere else. I would rather work at a fast food chain than work for Wal-Mart. Seniority this means nothing, as well. Truth hurts Wal-Mart and I just stopped shopping here altogether. You can get your products somewhere else, probably better quality too. Please save yourself the trouble.",1
They like to get people out that have Tenor ,They well do away with the job that you have because of someone taking over in their main office because they want to make their mark they like change but only when they can think of it they do not listen to the associates ,2
Worst place anybody could work,"Managers will avoid you instead of helping you. Management has no idea how to manage and avoid their job requirements the whole time they are there. You can't move up, or around for that matter, and all the managers have inappropriate relations with minors. I had to quit because they wouldn't give me a transfer when I moved an hour from the store.",1
Low Pay for a lot of work,"Wal mart doesn't pay very well. Being such a large company you would think they would pay for quality workers. Working the meat frozen and dairy almost daily by myself, it sometimes becomes overwhelming. This job is definitely more for a high-school, college kid. If you are looking to make a career here I don't think this is the place. ",2
The people who show up for work everyday in spite of the pandemic and do their best to serve the customers well are the rock of this company. ,This company has the vision mission and values that compels me to continue my Servant leadership here. The messages that are communicated by upper level management. ,5
Everyone jumps in to help when a serious situation arises.,The work is demanding and can be taxing yet everyone jumps in to help when a serious situation arises.  Can be hard to let go and end your day.....People treat each other with respect for the most part.Management encourages solutions in lieu of complaints - i.e. don't bring up a problem unless you have a solution.,5
Great place to work,"Love and admire this company, always put this country and associates first.  The CEO is intune with the country and all  Wal-Mart associations.  It’s really a great honor to work for this company.",5
Very little job security but potential for growth,Many opportunities for advancement and new challenges. However time in chair requirement can cause you to be stuck in a job for a long time. Very little job security. Company has had multiple large restructures which displaces many individuals. Stress level is very dependent on team and part of the company. Generally a really good place to learn. ,3
Good,Great work culture with great innovative team. Good compensation along with stock options and health insurance along with 401k .World's biggest Retail company and biggest employer and cross functional team working exp is valuable,4
I enjoyed my team but being contract for a 12 month project that went for 15 months I felt I was not sure any longer of my faith in leader,"I really loved my job but was a Temporary Contract with all positive reviews and comments for permanent role.  I waited 3 months after my 12 month contract and the lag time became stressful.  No perks, bonus PTO etc.  I am sorry and I have great references but just my leadership lacked strength in my humble opinion.",3
The settlement position,"Alot of steps in the process Alot of communication with suppliersMust be detail orientedMust be organizedTeam atmosphere was greatWork schedule was flexible",2
Ok Place to work,Depending on where you are working for Walmart it can both be a fantastic place and a little bit of rough the all in all it's a good job to have good management,3
Fun working for and feel like we were all a big family,Walmart was good to work for friendly family oriented n cared about there associates. Since times are changing we were out sourced to Genpact  Wish they had never gone in that direction ,5
good,Good benefits. New structure of the systems that they change the job codes of the job. Hired new people without experience and train them. Days off are split,3
A lot to learn,Wonderful hours and my coworkers were the best. I learned a lot about billing and speaking to vendors. I was able to speak to Hr without worrying about anything.,5
Productive,"Nice place to work, good work life balance.  Lots of travel involved with some positions.  Sometimes work life balance is tested however pretty strict.  Good people to work for and definitely a great company",4
Terrible,They only care about you as a cog in their big corporate machine. The constant propaganda you're subjected to will make you numb. The florescent lights mess up your sleep schedule.,1
Awesome Company,Awesome Company and i would love to work for  this company. office culture was great and we can learn new technologies and always inspiring work culture ,5
it's okay job,like the people i work with my place very fast paced all about meeting the metrics even when understaffed good team effort was easy for me to advance mainly cause of work ethic i show up and work hard,3
