Summary,Review,Rating
Very stressful place to work,"Most of my work day was sitting and working on my computer.I learned a LOT about commercial energy management, maintenance, project management, property management and building controls systems.The culture had gone downhill since I began with Walmart home office in 1996.The hardest part of the job was the associate unfairness and inequality within the department.The most enjoyable part of the job was the rare business travel and when we got together as a team.",3
Rapidly evolving workplace,"Walmart associates have the unique opportunity to affect millions of people every day. While the company is massive, each department is very lean and many groups function as startups trying to secure funding from corporate leadership to execute competing ideas. With the recent layoffs, teams have become increasingly lean - causing the environment to become even more competitive.",3
Productive and Fun.,"Dress was casual but clean.Fellow associates are wonderful to work with.Worked with a team.Sense of belonging, family.Expanding of knowledge possible and encouraged.Great coffee bars in the facilities.",4
Relaxed environment.,"Wanted things done accurately but no much sense of urgency.People are very nice yet competitive.Dress is very casual.Several systems have to work together to accomplish one process.",3
Don't do it,"Don't do it. Walmart is a cult. They will control every aspect of your life, and demand 100% loyalty, but show almost none in return. They are nearly always deceptive, frequently lying outright, and do not care one iota about your personal life. They will act like they do occasionally, but it is all superficial. Lots of politics and long hours.",1
Typical Day at work,Daily contribution to to product line quality control reporting. Also investigate and resolve customer dissatisfaction in a timely and empathetic manner.,4
This is a fun place to work,The work was repetitive and it could be difficult to get time off.  The hardest part was standing for long periods of time.  The most enjoyable part was interacting with the customers.,4
Extremely Busy,"I worked for Wal-Mart Inc for 20yrs. I worked in the stores for 10 years worked in every area in the store from the check outs to departments, layaway and claims clerk. I transferred to the home office and started in accounting on the help desk and moved to the people divisions RPA and then on to girlswear merchandising. I learned many valuable life lessons while working for this company they were always good to me.",4
Too Big,Event though there were several thousand people working in the corporate office there were many instances of the good ol boy network. CEO got into politics too much instead of working for shareholders.,2
Stressful,Sit down take calls up to 3 hours till first break and so on. So boring.Not much advancement. Lots of favoritism and no fun in the call center. Highly upset with the feeling in here.,3
All about Numbers Not People,I hate to say it but its true. I worked for this company for over 18 years and the culture has changed drastically! Pay is not worth the stress to say the least,2
Not Productive,"Working for this company is becoming a scary issue. A typical day was extremely busy with direction changing constantly. The one thing I enjoyed, was the people!",2
Looking for opportunity then look no futher,I came to the call center very optimistic mostly because this was a complete turn around from store to office setting and call center.  Everything went well and I found fellow managers and agents that were very excited to learn the next job to further a career with the company!,4
Great Culture,I enjoyed my time working in Walmart Technology. The work culture is amazing and everyone works together in a seamless fashion for such a big company. It still amazes me how everything comes together since there so many different things.,5
Walmart is exhausting,"Walmart starts out making you think its the greatest company in the world, and then you find out it's not what it's made out to be.  When the original owners had the company it was so much more interesting and now it's just another bottom line is the only thing that matters.",2
Excellent work place,Walmart is an excellent company to work for with plenty of career opportunities. It has a very strong culture and respect diversity. Walmart is working on the right process improvements to prepare to company for the future.,5
Room for advancement,There was plenty of room for advancement within the company. They offered classes to improve your skills and education as well. Not a bad place to work.,4
Corporate office setting,"This company is very cost conscious, but  tends to promote from within making it a good opportunity for advancement in all areas, even in the retail stores as well.",3
Good place to work,"So far so goodNo complaints , mangers are very ongoing, my favorite GMAlso good pay,,If meet all 3 tears bonus per QRBut is very hard to get hired",5
very good,"Excellent company. Great culture, structure and room for advancement. Strong sense of support for employees with extremely challenging and excellent projects, programs and people.",4
Workplace Culture,The workplace culture is awesome. They company is very active in diversity and inclusion for all walks of life. The majority of people are encouraging and uplifting when associates are going through a difficult place in their lives.,4
Good Workplace,"A typical day at work would be goodI have learned the architecture of the Replenishment SystemManagement and work place is goodThe enjoyable part is the challengening environment",4
Good people,Good work life/balance. Management is always trying to be accommodating to needs of your family or personal issues.  The higher up you go the more stressful but rewarding the job can be.,4
Not willing to make meaningful change,"Worked many years with the company as an Assistant And Co Manager. The market I spent the most time in never had core issues addressed. Instead, there was a long parade of market managers that would replace store managers over a 2-3 year period before they were ultimately replaced themselves.",4
High expectations,"Excellent place to build skills and learn from others. Expectations are always high.Managers and mentors were genuinely invested in helping associates grow.",4
Walmart Corporate Review,"Typical Day at my level is performing various business functions, or finishing up projects or presentations and attending meetings. They don't discourage doing things on your own and making mistakes is fine as long as your manager can see the logic. I like that about this place. You get a chance to work with a ton of people and typically they are very helpful.",4
There is nothing positive to say,Nothing positive to say about this company.  Walmart treats their employees terrible.  No consistency.  If you're a favorite you can do anything.  If you're not than be prepared to get in trouble all the time.,1
"Mixed Culture,","Stress, lacks work life Balance in most positions.  There are some great people here, but there are some that only see bottom line as the source of managing.",2
Largest retailer reinventing itself,Highly productive and competitive environment. Geared towards innovation. Trying to do more with less. Finding a balance between work and life is hard sometimes.,4
Job Work/Life Balance,It helped with being able to work from home when you or the kids were sick.  Walmart also helped with developing further skills for learning in a variety of computer languages including decision-making in design of software components.,4
walmart life in 4 years,Walmart is good for young kids looking for a job after high school or young adults looking for a stable job. If done right Walmart can also be a good career. work environment isn't always pleasant and can be very stressful at times do to other employees and management.,3
It was great in the beginning...,It was great until they got a new leadership in my team.  The outsourcing and re-badging needs to stop.  The work environment got way too stressful beginning of July 2017 and the future of the team appears uncertain.,3
Horrible,The management was horrible. Everyone was treated like trash. Unless of course you made 100k a year. Then you got treated like you were on a pedi stool.,1
it was alright,"I worked for Wal-mart Neighborhood market. Opened the location in Bentonville across from the harps, The manager at the time was a great guy and I enjoyed working for him. His assistant managers however is a different story. They where too passive aggressive and looked down upon the other employees. one in particular I did not agree with nor he agree with me. I did what I could to keep our interactions to a minimum so that I could avoid a workplace dispute. But he had his plans and would seek out trouble with the other employees and make it difficult for them too. When we all reported it to our manager little action was taking besides a light reprimanding. When it came to Verbal abuse from the assistant manager I spoke with my manager about but still nothing. I put in my two weeks and haven't bothered to seek further at Wal-Mart after that.",3
Demanding yet rewarding place to work,"Walmart has a culture of working very hard and putting the customer first.  It has a formula that works very well for traditional big box retail.  It's struggling to be successful in e-commerce, but is making logical moves to strengthen e-market presence.",3
Productive and Fast Paced enviroment,It was a pleasant experience overall while working here. Management and Co-workers are extremely friendly and they provide a good support group if any questions needed to be asked.,3
Legacy management practices,"So stuck in 1960s top down management they don't relize it.  They say all the modern management things, but they are so set in old ways it isn't even obvious to them.",2
Will learn a lot,"Overall, Walmart is a great place to work. You will learn a lot and it is a fast pace environment because of the evolution of Retail.  My recommendation is to learn as much as possible while there.",4
Corporate office setting,"This company is very cost conscious, but  tends to promote from within making it a good opportunity for advancement in all areas, even in the retail stores as well.",3
Good,This is a good place to work. There are a lot of opportunities to grow in this department.  The managers and staff were helpful and nice to work with. The environment is also warming and a great place to achieve with productivity and teamwork.,4
Experience,"I have worked at Walmart for almost 10 years.  The work experience I have gained over the years has been incredible.  Customer Service, Flexibility, Decision Making, Effective Communication, etc.",3
I worked for the best team.,I worked for the best team within the company.  It was a great experience.  I wouldn't trade the experience & companionship for anything.  I was able to expand my knowledge outside the basic legal scope of the business.,3
Enjoyable part,"My favorite part of the day was working with my field associates.  I enjoyed the managers, clerks, and human resource managers and clerks I worked with out in the field.",3
Training,"You were promised training and never received it.  I enjoyed the assignment and workplace atmosphere.  People very friendly.I learned a lot during this assignment.",2
productivity and good environment,Good place and environment  to work.                 Some times stressful.   Good benefits and pay ..                  Need more floor support for my job.,4
"Fun, competitive environment!",Walmart is the perfect place to work and learn the ropes of retail.  You can't get a better education than working for them.  Not always 8-5 and some Saturdays required.,5
Lacks Culture and Development,If you are a Millenial. The culture will be very slow and very little opportunity for career growth. There is a lot of reorganization and management is too busy to develop associates. Lacks diversity in Home Office setting.,2
Extremely stressful and cut-throat (Home Office only),"Long days required to get the job done, including sometimes having to give up vacations.  Cut throat co-workers, favoritism was apparent  Terrible work / life balance. Company more interested at meeting their goals than what was going on with your family.",3
Unstable and poor culture,"Poor culture; Unstable job environment due to competition from Amazon; Stressful; lots of politics; lots of friction with eCom team in San Jose, CA; would not recommend anyone to join the company;",1
Nice place to work,I strongly believe that this is a nice place to work. Amazing work life balance for an man level job. Small work force so you get a lot of responsibility early on.,4
"Challenging, Fast Paced environment.  New opportunities","Leadership will take time to develop your skills and experiences.  Work Life Balance and the ability to work remote is often available.  Opportunities are abundant with mentoring available, job shadowing, and continued education.",5
Bad work culture,Very cut throat attitude among employees. Lots of layoffs. Stock is decreasing. Very poor management leadership.   Strict travel rules and budgets.AAAAAAAAAAAAAAAAAA,2
No frills retailer in transition,Traditional brick and mortar retailer with designs at becoming a major e-commerce player.  Walmart culture is integrated into everything at the home office (all meetings begin with the walmart or Sam's cheer) and understanding that culture is a key to success.,4
Corporate Security,Corporate security is great for someone looking for a reactive job. There is little work to do until there is something generated. The managament does not seem to have a full grasp on how to organize themselves or the department. Little gets accomplished with lots of busy work in between. If you get the position or schedule you want hold on to it or it will be gone. Great place to work to get to know friendly people.,4
Quick paced and great management,Worked with a great team to help accomplish the transportation needs that were required of us to make sure facilities had the items picked up and delivered on time to ensure customer satisfaction.,5
The biggest and best company on the Planet,"If you want to make an impact on the planet, Walmart will give you the platform to do so. Everything you do impacts millions and millions of customers all over the world.",5
"In general, a good place to work.",System group iscurrently going through a tech modernization program to become a digital company.  A considerable number of positions have been eliminated recently and more reductions are expected.,3
Great Company,"Great Company to work for and to be a part of, lots of room for advancement in the many divisions and departments. Moving around can be a bit challenging with interview process.",4
Temp work at home office,"Keep in mind that your direct manager on the job is not, and has so little to do, with the people who decide your employment when you're temp at walmart.",4
Corporate office setting,"This company is very cost conscious, but  tends to promote from within making it a good opportunity for advancement in all areas, even in the retail stores as well.",3
Great working environment.,Very diverse. You meet a lot of interesting and good people. Team work is big there. You have good chances to grow and advance there. I had a great experience there.,4
Hard for minority,"Not a  place you can be yourself. Management shows favoritism. I been there a year and they had 4 Mass Fires, hundreds of people lost their jobs. Jobs are not secure at Walmart at all.",2
"Good Job, don't buy the ""Family"" hype","Worked long term and was well compensated.  Coworker's were really great people, however leadership spoke a lot to ""Family"" but made decisions daily that demonstrated you were really just an employee.  Take the talk with a grain of salt, leadership feels no guilt in laying off talented experienced associates to achieve their goals and bonuses.",3
Acting Out Desperation on Associates,"There is a strong sense that everybody is in it for themselves. While Walmart has the resources to bring in top talents around the world, it has yet to learn how to keep these talents. The advancement opportunities are challenging to say the least;  ranks, status, and class are extremely important as much as they tell you otherwise; innovation from the rank and file are not embraced, but once the senior management decided something has to be done it is their way or highway. The ""open door policy"" is a joke. You will be thrown out the door if you ever dare to challenge your management for their wrong doing or dishonesty. In my two years I have seen at least 12 rounds of layoffs at this company. Too much instability and uncertainty.",3
n/a,Company moral on a corporate level is different from a store level. Management was very understanding of problems and accommodated accordingly. Great work place.,3
Administrative Assistant,"When I first joined  Walmart, it was my first job in a different country.  As soon as I started, the assistant I had to report to, just handed all the work (piles and piles of tasks that hadn't been done ... hardly any training .. it was a sink or swim situation.  After I got the hand on things, everything improved",2
Ok,Ok at best . Read the cons section. At least I was employed for over 9 years and was able to learn and build my career.  Now I have to start  from the bottom,3
good place to work,I have enjoyed my time there. I learned a lot as there isnt a typical day at Walmart. It is a dynamic culture that require strong leadership and collaboration skills,4
It's up to you,"You can make whatever you want of this company. Just like most jobs, it's just a matter of how what kind of work life balance you want. Most managers start as hourly. That's not just something they say. Managers can make very good money. Hourly associates can also make pretty good money. Work hard, show up on time. Really not difficult.",4
Workplace culture,"Management does not necessarily have the skills to manage the teams they are in charge of.  Once a person's skills are known, easily can be taken advantage of by being asked to ""help out"" others and made to feel guilty if leaving work on time.  Enjoyed friendships made during the time there.",2
walmart overview,"I started at the optical lab which in this facility it was air conditioned and involved light lifting and minimum walkingafter 9 years I transferred to the reclaim warehouse in Bentonville this building is a metal building with no work area ac which requires continuous heavy lifting and two small breaks are given in a ten hour period inadequate for any decent lunch break. For a older person I would not recommend this job location.",4
Best place I have worked,"Working here I felt like I was part of a family.  My management had my back when a personal situation effected my performance and stood behind me to get through it,  I lost two family members while employed at Walmart and they were very supportive during that trying time.",4
Great company to work for - apart from middle management issues and politics,"Fantastic culture, great message, true belief in work/life balance.   Poor middle management (most VP's and above are great...directors and below are all about maintaining the status quo).     Every job I've had here was highly political (I've had many).  ""Perception is reality"" is bandied about relentlessly.  Project management is all about money and dates, not really much maturity in quality deliveries or usable products. Scale works for you - when you do something cool it affects 2 million associates or millions upon millions of customers.  You can be an engineer one year, an HR representative 3 years later, and an IT manager 3 years after that.  Walmart offers unparalleled job diversity.    Scale also works against you, to get something done you need to know the right people and build the right relationships or walls of red tape will appear out of nowhere.   Overall, it's a great company to work for (speaking from a home office perspective).  Management woes are not unusual, the ability to navigate a political environment is a must, and you can easily find glass ceilings if you go against the grain of your manager's style.  I could just be a difficult/hard to manage associate, but I've had approximately 10 bosses and only 3 of them I would recommend to others.",4
Great Place to Grow,Walmart is one of the largest companies in the world making it an awesome place to start a career and learn the ins and outs of the different areas in the retail industry.,5
"Educational, fast-paced, fun","Lots of learnings, fast paced, friendly work environment.  Learned a lot about the whole supply chain.  Culture is great!  Enjoyed the people I worked with.",5
Everything I am today I learned for Walmart,"Walmart is a great company to work for. You learn so much really fast. They want you to be successful. They will listen to your ideas and change if needed. If you are successful so are they. They understand it's the associates that make them successful. They really drive home dedication, flexibility, and reliability. It's their core for each associate to be this type of person.",5
"Productive environment with good culture, dedicated and engaged management.","Overall experience was positive, gained great business and IT knowledge and had the opportunity to engage with great co-workers and experts in a variety of fields.",4
Hourly Supervisor,Supervised 78 hourly associates for Walmart.com. Performed customer escalation resolutions. Wrote evaluations. Performed interviews for new hires. Assisted in investigations on performance issues.,4
renewed IS facility,"ISD just got refurbished, though now a ghost town due to jet.com aquisition, other M&A activities. Senior PM experience is being sacrificed for newley-minted MBA's, and/or coders with additional tasking of project management as a facilitation effort to deliver. CEO 'support the associates' approach is meant for hourly employees in the stores, NOT the back-office professionals.",2
An awesome job at a company with the ability to change the world,I learned marketing fundamentals by while having the ability to work on various types of projects and businesses. Everything centered on putting the customer first.,4
Corporate office setting,"This company is very cost conscious, but  tends to promote from within making it a good opportunity for advancement in all areas, even in the retail stores as well.",3
Excellent and fun workplace.,I really enjoyed working here and I am really thankful that I got this opportunity to work hear and learn new skills. Overall a great place to work. I really recommended this place to work.,5
Good environment,"The work was not hard and you had help all around.  Easy to get help anywhere you look, but they are very by the book.  they follow policies strictly, which lead to my termination.",4
Need to accommodate various learning styles,The position I was placed in required training in a training room. As an individual who does not do well in a training room environment this was not a very good fit for me.,3
Very political,"Rather refrain from sharing.  Working harder rather than smarter mindset.  - Old associates unwilling to embrace change.  If it ain't broken, do not fix it mentality. - Middle managers protecting their role and seniority at the expense of others.",2
The Return Center was a good place to work,At the Return Center everyone work as a team.  The Management was good to work with the assonant and make sure the work environment was good  and your got overtime.,3
You had to work as a team.,"This was a productive fast pace working environment.  You had to work as a team. the most enjoyable part of the job was the people. Management was good.",2
Ok,Has good culture and advancement. I guess you have to like speaking on the phone to enjoy this job- and helping people of course. Its not as bad as customer service/Customer relations. Here you can actually help people more and its a smaller team. Less than 30,3
hostile work environment,No job security. There is a lot of backstabbing and fighting to get to the top. Consistent unethical behavior from supervisors. No respect for individuals. Consistent retaliation for associates that utilize the open door policy.,1
Easy to work with people.,"I never expected to ever work for Walmart as I didn't know much of their culture and had bad views about them. However that all changed once I started working there.  As an Application Developer I get to do many fun project related to web and native applications.  The Culture there is amazing. People are so nice and they respect you and listen to what you have to say.  Also teams are very supportive of each other and thats once of the things i love the most working there.",5
Stressful,"a typical day running reports and managing supplier needs, Management team are not so good there's alot a micro managing. The culture of the company is nothing like it was a few years ago and based on seasonal employees its not what Sam Walton based his company on. The hardest part about this job there was no accurate training you will need to be a self starter and motivator and find ways to learn the job, the supervisors currently in the role don't care anymore. Most enjoyable part of the job is other members on your team and in the company",3
Competitive Salary and Benefits yet no work life balance or job security.,Competitive Salary and Benefits yet no work life balance or job security. Constant Layoffs especially affecting long term associates. Can not make a life long career due to round after round of Layoff's,2
